{
  "schema_version": "niannian_video_workbench_task_packet_v1",
  "task_id": "NIANNIAN-WB-REAL-I2V-4S-20260728-01",
  "created_at": "2026-07-28T04:19:20.953Z",
  "project": "niannian-ai-video-workbench",
  "objective": "Produce and verify one real 4-second image-to-video delivery through the normal owner customer path.",
  "user_binding": {
    "owner_account": "liusb0713@qq.com",
    "user_surface": "https://sd2.cauai.fun",
    "website_credit_reservation": 16,
    "customer_paths": ["create", "project_visibility", "playback", "download"]
  },
  "production_spec": {
    "generation_type": "image_to_video",
    "reference_sha256": "59388ad9cc2e37e5d54b03b24f303fb0d83a6a740b4f0d1c9ab7e8af4c375454",
    "model": "Seedance 2.0",
    "duration_seconds": 4,
    "aspect_ratio": "16:9",
    "resolution": "720P",
    "channel": "mimo",
    "execution_mode": "codex_skill",
    "maximum_generate_attempts": 1
  },
  "locked_prompt": "一名年轻男子在未来感便利店里拿起一瓶普通矿泉水，瓶盖打开瞬间，整个便利店像失重空间一样漂浮起来，零食和彩色包装缓慢环绕他旋转。他先惊讶地环顾四周，随后对镜头露出得意微笑，喝下一口水。电影感运镜，真实人物，动作自然，光影清晰，无文字，无水印。",
  "scope": {
    "allowed_paths": [
      "E:/codex/aisp/aidaihuo/niannian-ai-web",
      "tencent-niannian:/opt/niannian-ai-video-workbench",
      "psyidc-windows:niannian-mimo-worker",
      "https://sd2.cauai.fun"
    ],
    "forbidden_projects": ["niannian-ai-main-site", "redraw", "/stage/01", "ai.cauai.fun"],
    "external_actions": ["provider_submit", "spend"]
  },
  "dependencies": ["HARNESS-INIT-20260728-01"],
  "acceptance_criteria": [
    "one_new_website_task_owned_by_liusb0713_qq_com",
    "exact_spec_reference_and_prompt_identities",
    "exactly_one_new_provider_task_id",
    "visible_provider_cost_at_most_8_with_before_after_actual",
    "website_credit_reserved_or_charged_once_and_refunded_at_most_once_on_failure",
    "mp4_sha256_bytes_and_ffprobe_duration_resolution_codecs",
    "task_specific_artifact_ledger",
    "cos_object_readback_matches_mp4",
    "website_completed_and_delivered",
    "authenticated_native_playback_success",
    "native_browser_download_matches_worker_and_cos"
  ],
  "authority_gate": {
    "required": true,
    "authorization_id": "VIDEO_WORKBENCH_REAL_DELIVERY_DECISION_20260728_01",
    "authorized_actions": ["create_exact_owner_task", "reserve_16_website_credits_once", "read_visible_mimo_cost", "click_generate_once_if_cost_at_most_8", "sync_exact_provider_receipt", "deliver_exact_task"]
  },
  "cost_gate": {
    "required": true,
    "currency": "Mimo credits",
    "expected": 8,
    "maximum": 8,
    "authorized": true
  },
  "writer_surfaces": ["queue_state", "provider_submission", "billing_ledger", "artifact_ledger"],
  "artifact_roles": ["provider_receipt", "provider_cost_readback", "video_mp4", "ffprobe", "artifact_ledger", "cos_readback", "website_playback", "browser_download"],
  "replaces_packet_sha256": null
}
